flashfusion/results/with_slm_predictive/mit_ecg/run_2/metrics.csv

baseline,query_id,gt_score,gt_method,latency_s,cost_usd,input_tokens,output_tokens,executed,rejected,judge_verdict,stages_run,s1_latency_s,s2_latency_s,s3_latency_s,guardrail_latency_s,agent_latency_s,s1_latency_ms,s2_latency_ms,s3_latency_ms,guardrail_latency_ms,agent_latency_ms
AUTOIOT_PAPER,1,1.0,llm_judge_score,286.31290078163147,0.007717210000000001,11585,4392,True,False,N/A,"autoiot_terms,autoiot_search_queries,autoiot_retrieval,autoiot_design_high,autoiot_design_detail,autoiot_module_gen,autoiot_code_integration,autoiot_agent_loop,autoiot_select",13.539063624994014,30.890517541003646,64.26248408397078,57.9784901659732,119.19578729201749,13539.063624994014,30890.517541003646,64262.484083970776,57978.4901659732,119195.78729201749
AUTOIOT_PAPER,2,1.0,llm_judge_score,269.25423097610474,0.009052559999999998,13449,5401,True,False,N/A,"autoiot_terms,autoiot_search_queries,autoiot_retrieval,autoiot_design_high,autoiot_design_detail,autoiot_module_gen,autoiot_code_integration,autoiot_agent_loop,autoiot_select",13.923900584006333,13.755347625003196,69.16303745898767,104.41708437498892,67.50462466602039,13923.900584006333,13755.347625003196,69163.03745898767,104417.08437498892,67504.62466602039
AUTOIOT_PAPER,3,1.0,llm_judge_score,338.63412714004517,0.010187939999999998,14435,6387,True,False,N/A,"autoiot_terms,autoiot_search_queries,autoiot_retrieval,autoiot_design_high,autoiot_design_detail,autoiot_module_gen,autoiot_code_integration,autoiot_agent_loop,autoiot_select",10.343871332006529,16.13098508400435,166.29911858399282,73.76340458403865,71.6409866670001,10343.871332006529,16130.985084004351,166299.11858399282,73763.40458403865,71640.9866670001
AUTOIOT_PAPER,4,1.0,llm_judge_score,299.7788770198822,0.01001529,13870,6072,True,False,N/A,"autoiot_terms,autoiot_search_queries,autoiot_retrieval,autoiot_design_high,autoiot_design_detail,autoiot_module_gen,autoiot_code_integration,autoiot_agent_loop,autoiot_select",11.59975645900704,23.529756292002276,92.88618104100169,65.2117069990054,106.1019429149892,11599.75645900704,23529.756292002276,92886.18104100169,65211.7069990054,106101.9429149892
AUTOIOT_PAPER,5,0.0,llm_judge_score,461.3339612483978,0.016461659999999996,23142,10525,True,False,N/A,"autoiot_terms,autoiot_search_queries,autoiot_retrieval,autoiot_design_high,autoiot_design_detail,autoiot_module_gen,autoiot_code_integration,autoiot_agent_loop,autoiot_select",10.447949958004756,21.36385504200007,31.006365708002704,66.82797604103689,331.2082067080046,10447.949958004756,21363.85504200007,31006.365708002704,66827.97604103689,331208.2067080046
AUTOIOT_PAPER,6,0.0,llm_judge_score,270.8068959712982,0.013173929999999999,17544,7955,True,False,N/A,"autoiot_terms,autoiot_search_queries,autoiot_retrieval,autoiot_design_high,autoiot_design_detail,autoiot_module_gen,autoiot_code_integration,autoiot_agent_loop,autoiot_select",21.358932792005362,21.795821375009837,70.57424337498378,39.717893456996535,116.87215233400639,21358.932792005362,21795.821375009837,70574.24337498378,39717.893456996535,116872.15233400639
AUTOIOT_PAPER,7,1.0,llm_judge_score,425.69231700897217,0.01319053,18078,8178,True,False,N/A,"autoiot_terms,autoiot_search_queries,autoiot_retrieval,autoiot_design_high,autoiot_design_detail,autoiot_module_gen,autoiot_code_integration,autoiot_agent_loop,autoiot_select",12.235944874992128,26.27713699900778,82.03631262501585,125.5704141229944,179.1016605420009,12235.944874992128,26277.13699900778,82036.31262501585,125570.4141229944,179101.6605420009
AUTOIOT_PAPER,8,1.0,llm_judge_score,287.9216089248657,0.010246749999999999,14639,5590,True,False,N/A,"autoiot_terms,autoiot_search_queries,autoiot_retrieval,autoiot_design_high,autoiot_design_detail,autoiot_module_gen,autoiot_code_integration,autoiot_agent_loop,autoiot_select",9.05838608299382,12.412097666005138,52.57655779100605,56.283310122962575,157.10096079199866,9058.38608299382,12412.097666005138,52576.55779100605,56283.310122962575,157100.96079199866
AUTOIOT_PAPER,9,0.0,llm_judge_score,676.061431646347,0.016689640000000002,24190,10969,True,False,N/A,"autoiot_terms,autoiot_search_queries,autoiot_retrieval,autoiot_design_high,autoiot_design_detail,autoiot_module_gen,autoiot_code_integration,autoiot_agent_loop,autoiot_select",13.253121960005956,49.69724295800552,81.54251416599436,164.49050429199997,366.64301220899506,13253.121960005956,49697.24295800552,81542.51416599436,164490.50429199997,366643.01220899506
AUTOIOT_PAPER,10,0.0,llm_judge_score,713.5227768421173,0.01735156,22955,12196,True,False,N/A,"autoiot_terms,autoiot_search_queries,autoiot_retrieval,autoiot_design_high,autoiot_design_detail,autoiot_module_gen,autoiot_code_integration,autoiot_agent_loop,autoiot_select",8.461268375991494,58.196830415996374,94.93058366600599,215.33232479503204,336.104451081992,8461.268375991494,58196.83041599637,94930.58366600599,215332.32479503204,336104.451081992
AUTOIOT_PAPER,11,0.0,llm_judge_score,225.14803409576416,0.007832389999999998,11759,4558,True,False,N/A,"autoiot_terms,autoiot_search_queries,autoiot_retrieval,autoiot_design_high,autoiot_design_detail,autoiot_module_gen,autoiot_code_integration,autoiot_agent_loop,autoiot_select",7.583095124020474,48.563883208000334,21.19541395799024,48.66239758298616,98.66622366699448,7583.095124020474,48563.883208000334,21195.41395799024,48662.39758298616,98666.22366699448
AUTOIOT_PAPER,12,0.0,llm_judge_score,608.2010669708252,0.015581379999999999,20250,10082,True,False,N/A,"autoiot_terms,autoiot_search_queries,autoiot_retrieval,autoiot_design_high,autoiot_design_detail,autoiot_module_gen,autoiot_code_integration,autoiot_agent_loop,autoiot_select",10.875594333003392,33.86984037500224,156.7170127069985,75.4424599170161,330.7913702909864,10875.594333003392,33869.84037500224,156717.0127069985,75442.4599170161,330791.3702909864
AUTOIOT_PAPER,13,1.0,llm_judge_score,457.34288787841797,0.01577054,21859,10235,True,False,N/A,"autoiot_terms,autoiot_search_queries,autoiot_retrieval,autoiot_design_high,autoiot_design_detail,autoiot_module_gen,autoiot_code_integration,autoiot_agent_loop,autoiot_select",7.007222290994832,31.82060420900234,75.85524950099352,78.6850466629985,263.48299362597754,7007.222290994832,31820.60420900234,75855.24950099352,78685.0466629985,263482.99362597754
AUTOIOT_PAPER,14,0.0,llm_judge_score,721.7628190517426,0.02219937,31360,14768,True,False,N/A,"autoiot_terms,autoiot_search_queries,autoiot_retrieval,autoiot_design_high,autoiot_design_detail,autoiot_module_gen,autoiot_code_integration,autoiot_agent_loop,autoiot_select",11.76195062599436,34.48780479199195,79.42474616700201,91.513775791027,504.24435495902435,11761.95062599436,34487.80479199195,79424.74616700201,91513.775791027,504244.35495902435
AUTOIOT_PAPER,15,1.0,llm_judge_score,546.8184609413147,0.01498086,21223,9951,True,False,N/A,"autoiot_terms,autoiot_search_queries,autoiot_retrieval,autoiot_design_high,autoiot_design_detail,autoiot_module_gen,autoiot_code_integration,autoiot_agent_loop,autoiot_select",59.47210245799215,16.158983083005296,240.54087920799793,78.28550820999953,151.8738749170152,59472.10245799215,16158.983083005296,240540.87920799793,78285.50820999953,151873.8749170152
AUTOIOT_PAPER,16,0.0,llm_judge_score,672.6227679252625,0.020565609999999998,30633,13511,True,False,N/A,"autoiot_terms,autoiot_search_queries,autoiot_retrieval,autoiot_design_high,autoiot_design_detail,autoiot_module_gen,autoiot_code_integration,autoiot_agent_loop,autoiot_select",10.393802874998073,25.593817832996137,98.40645233402029,224.7315195419942,312.98057887298637,10393.802874998073,25593.817832996137,98406.45233402029,224731.5195419942,312980.57887298637
FLASH_FUSION,1,1.0,llm_judge_score,38.25417995452881,0.00143555,3095,181,True,False,N/A,"S1,S2,guardrail,S3,agent",6.863892078399658,5.899619102478027,5.700139999389648,4.197499990463257,11.613862991333008,6863.892078399658,5899.619102478027,5700.139999389648,4197.499990463257,11613.862991333008
FLASH_FUSION,2,1.0,llm_judge_score,33.979552030563354,0.00148028,3201,190,True,False,N/A,"S1,S2,guardrail,S3,agent",6.544484853744507,5.962299823760986,3.964832067489624,3.9046919345855713,9.655836343765259,6544.484853744507,5962.299823760986,3964.832067489624,3904.6919345855713,9655.836343765259
FLASH_FUSION,3,1.0,llm_judge_score,25.406506061553955,0.0014608400000000001,3113,199,True,False,N/A,"S1,S2,guardrail,S3,agent",1.3416821956634521,2.4862260818481445,3.0619802474975586,3.8465468883514404,10.690140008926392,1341.6821956634521,2486.2260818481445,3061.9802474975586,3846.5468883514404,10690.140008926392
FLASH_FUSION,4,1.0,llm_judge_score,31.06201410293579,0.0016095600000000001,3292,270,True,False,N/A,"S1,S2,guardrail,S3,agent",0.5381608009338379,2.4584860801696777,7.110380172729492,5.178257942199707,11.772463083267212,538.1608009338379,2458.4860801696777,7110.380172729492,5178.257942199707,11772.463083267212
FLASH_FUSION,5,0.0,guardrail_skip_unexpected_rejection,30.95281195640564,0.00064896,1871,329,False,True,N/A,"S1,S2,guardrail",1.6889629364013672,19.495594024658203,0.0,5.73176383972168,0.0,1688.9629364013672,19495.594024658203,0.0,5731.76383972168,0.0
FLASH_FUSION,6,1.0,llm_judge_score,39.50448799133301,0.00184927,3374,515,True,False,N/A,"S1,S2,guardrail,S3,agent",2.6641879081726074,2.689927101135254,2.097733736038208,7.337599992752075,20.88539695739746,2664.1879081726074,2689.927101135254,2097.733736038208,7337.599992752075,20885.39695739746
FLASH_FUSION,7,1.0,llm_judge_score,45.53845405578613,0.0021861,3929,656,True,False,N/A,"S1,S2,guardrail,S3,agent",1.7465059757232666,8.071052074432373,8.168310165405273,4.424555063247681,19.196985006332397,1746.5059757232666,8071.052074432373,8168.310165405273,4424.555063247681,19196.985006332397
FLASH_FUSION,8,1.0,llm_judge_score,32.37486791610718,0.00178756,3580,349,True,False,N/A,"S1,S2,guardrail,S3,agent",1.9876108169555664,8.164575099945068,3.387385845184326,4.25351881980896,10.620582103729248,1987.6108169555664,8164.575099945068,3387.385845184326,4253.51881980896,10620.582103729248
FLASH_FUSION,9,1.0,guardrail_skip_expected_rejection,27.98611307144165,0.00066829,1874,362,False,True,N/A,"S1,S2,guardrail",1.9304461479187012,16.19365096092224,0.0,5.936017036437988,0.0,1930.4461479187012,16193.650960922241,0.0,5936.017036437988,0.0
FLASH_FUSION,10,1.0,guardrail_skip_expected_rejection,17.895397901535034,0.00048185999999999997,1602,83,False,True,N/A,"S1,S2,guardrail",0.5685691833496094,2.67806077003479,0.0,10.864495038986206,0.0,568.5691833496094,2678.06077003479,0.0,10864.495038986206,0.0
FLASH_FUSION,11,1.0,guardrail_skip_expected_rejection,11.133039951324463,0.0004894999999999999,1613,101,False,True,N/A,"S1,S2,guardrail",0.6184308528900146,0.9496462345123291,0.0,5.806929111480713,0.0,618.4308528900146,949.6462345123291,0.0,5806.929111480713,0.0
FLASH_FUSION,12,1.0,guardrail_skip_expected_rejection,10.12889289855957,0.00049063,1630,91,False,True,N/A,"S1,S2,guardrail",0.22359824180603027,0.5021390914916992,0.0,5.627135992050171,0.0,223.59824180603027,502.1390914916992,0.0,5627.135992050171,0.0
FLASH_FUSION,13,1.0,llm_judge_score,38.74842619895935,0.00200809,3560,623,True,False,N/A,"S1,S2,guardrail,S3,agent",0.9375767707824707,1.3541581630706787,7.575132131576538,3.9736828804016113,21.097209930419922,937.5767707824707,1354.1581630706787,7575.132131576538,3973.6828804016113,21097.209930419922
FLASH_FUSION,14,0.0,llm_judge_score,91.25144696235657,0.00300816,4739,1003,True,False,N/A,"S1,S2,guardrail,S3,agent",1.1623821258544922,2.486248016357422,1.4309160709381104,4.6094970703125,77.55179595947266,1162.3821258544922,2486.248016357422,1430.9160709381104,4609.4970703125,77551.79595947266
FLASH_FUSION,15,0.0,llm_judge_score,54.451871156692505,0.00223804,4217,1232,True,False,N/A,"S1,S2,guardrail,S3,agent",9.031294107437134,0.6606569290161133,8.607676029205322,4.017398118972778,28.165191888809204,9031.294107437134,660.6569290161133,8607.676029205322,4017.3981189727783,28165.191888809204
FLASH_FUSION,16,1.0,llm_judge_score,45.09103298187256,0.00240689,4110,812,True,False,N/A,"S1,S2,guardrail,S3,agent",6.842061996459961,8.599601984024048,2.975421905517578,3.962846040725708,18.783005237579346,6842.061996459961,8599.601984024048,2975.421905517578,3962.846040725708,18783.005237579346
REACT_ONLY,1,1.0,llm_judge_score,10.713045835494995,0.00027685000000000003,413,42,True,False,N/A,react_agent,0.0,0.0,0.0,0.0,0.0,0.0,0.0,0.0,0.0,0.0
REACT_ONLY,2,1.0,llm_judge_score,11.091799974441528,0.00028412,428,40,True,False,N/A,react_agent,0.0,0.0,0.0,0.0,0.0,0.0,0.0,0.0,0.0,0.0
REACT_ONLY,3,1.0,llm_judge_score,11.076405048370361,0.00029929999999999996,439,51,True,False,N/A,react_agent,0.0,0.0,0.0,0.0,0.0,0.0,0.0,0.0,0.0,0.0
REACT_ONLY,4,1.0,llm_judge_score,12.464996099472046,0.00031685,450,65,True,False,N/A,react_agent,0.0,0.0,0.0,0.0,0.0,0.0,0.0,0.0,0.0,0.0
REACT_ONLY,5,1.0,llm_judge_score,12.653926134109497,0.00038061,463,136,True,False,N/A,react_agent,0.0,0.0,0.0,0.0,0.0,0.0,0.0,0.0,0.0,0.0
REACT_ONLY,6,1.0,llm_judge_score,10.856621026992798,0.00029064,427,49,True,False,N/A,react_agent,0.0,0.0,0.0,0.0,0.0,0.0,0.0,0.0,0.0,0.0
REACT_ONLY,7,0.0,llm_judge_score,13.31358790397644,0.00037873999999999997,421,165,True,False,N/A,react_agent,0.0,0.0,0.0,0.0,0.0,0.0,0.0,0.0,0.0,0.0
REACT_ONLY,8,1.0,llm_judge_score,16.604987859725952,0.00032855,431,94,True,False,N/A,react_agent,0.0,0.0,0.0,0.0,0.0,0.0,0.0,0.0,0.0,0.0
REACT_ONLY,9,0.0,llm_judge_score,12.350880146026611,0.00034196,439,105,True,False,N/A,react_agent,0.0,0.0,0.0,0.0,0.0,0.0,0.0,0.0,0.0,0.0
REACT_ONLY,10,0.0,llm_judge_score,13.790724039077759,0.00042688000000000003,441,211,True,False,N/A,react_agent,0.0,0.0,0.0,0.0,0.0,0.0,0.0,0.0,0.0,0.0
REACT_ONLY,11,1.0,llm_judge_score,15.546496868133545,0.00049645,737,78,True,False,N/A,react_agent,0.0,0.0,0.0,0.0,0.0,0.0,0.0,0.0,0.0,0.0
REACT_ONLY,12,0.0,llm_judge_score,15.208641052246094,0.00040282,427,191,True,False,N/A,react_agent,0.0,0.0,0.0,0.0,0.0,0.0,0.0,0.0,0.0,0.0
REACT_ONLY,13,1.0,llm_judge_score,27.1516170501709,0.00049543,513,244,True,False,N/A,react_agent,0.0,0.0,0.0,0.0,0.0,0.0,0.0,0.0,0.0,0.0
REACT_ONLY,14,0.0,llm_judge_score,68.045077085495,0.00127323,1285,652,True,False,N/A,react_agent,0.0,0.0,0.0,0.0,0.0,0.0,0.0,0.0,0.0,0.0
REACT_ONLY,15,1.0,llm_judge_score,16.718113899230957,0.00051985,541,254,True,False,N/A,react_agent,0.0,0.0,0.0,0.0,0.0,0.0,0.0,0.0,0.0,0.0
REACT_ONLY,16,1.0,llm_judge_score,12.277451038360596,0.00050945,514,261,True,False,N/A,react_agent,0.0,0.0,0.0,0.0,0.0,0.0,0.0,0.0,0.0,0.0

flashfusion/results/with_slm_predictive/mit_ecg/run_2/report.md

#### AUTOIOT_PAPER

- Executed: True | Rejected: False | Judge: N/A
- Stages: autoiot_terms,autoiot_search_queries,autoiot_retrieval,autoiot_design_high,autoiot_design_detail,autoiot_module_gen,autoiot_code_integration,autoiot_agent_loop,autoiot_select
- Latency: 286.31s | Cost: $0.00772

- Executed: True | Rejected: False | Judge: N/A
- Stages: autoiot_terms,autoiot_search_queries,autoiot_retrieval,autoiot_design_high,autoiot_design_detail,autoiot_module_gen,autoiot_code_integration,autoiot_agent_loop,autoiot_select
- Latency: 269.25s | Cost: $0.00905

- Executed: True | Rejected: False | Judge: N/A
- Stages: autoiot_terms,autoiot_search_queries,autoiot_retrieval,autoiot_design_high,autoiot_design_detail,autoiot_module_gen,autoiot_code_integration,autoiot_agent_loop,autoiot_select
- Latency: 338.63s | Cost: $0.01019

- Executed: True | Rejected: False | Judge: N/A
- Stages: autoiot_terms,autoiot_search_queries,autoiot_retrieval,autoiot_design_high,autoiot_design_detail,autoiot_module_gen,autoiot_code_integration,autoiot_agent_loop,autoiot_select
- Latency: 299.78s | Cost: $0.01002

- Executed: True | Rejected: False | Judge: N/A
- Stages: autoiot_terms,autoiot_search_queries,autoiot_retrieval,autoiot_design_high,autoiot_design_detail,autoiot_module_gen,autoiot_code_integration,autoiot_agent_loop,autoiot_select
- Latency: 461.33s | Cost: $0.01646

- Executed: True | Rejected: False | Judge: N/A
- Stages: autoiot_terms,autoiot_search_queries,autoiot_retrieval,autoiot_design_high,autoiot_design_detail,autoiot_module_gen,autoiot_code_integration,autoiot_agent_loop,autoiot_select
- Latency: 270.81s | Cost: $0.01317

- Executed: True | Rejected: False | Judge: N/A
- Stages: autoiot_terms,autoiot_search_queries,autoiot_retrieval,autoiot_design_high,autoiot_design_detail,autoiot_module_gen,autoiot_code_integration,autoiot_agent_loop,autoiot_select
- Latency: 425.69s | Cost: $0.01319

- Executed: True | Rejected: False | Judge: N/A
- Stages: autoiot_terms,autoiot_search_queries,autoiot_retrieval,autoiot_design_high,autoiot_design_detail,autoiot_module_gen,autoiot_code_integration,autoiot_agent_loop,autoiot_select
- Latency: 287.92s | Cost: $0.01025

- Executed: True | Rejected: False | Judge: N/A
- Stages: autoiot_terms,autoiot_search_queries,autoiot_retrieval,autoiot_design_high,autoiot_design_detail,autoiot_module_gen,autoiot_code_integration,autoiot_agent_loop,autoiot_select
- Latency: 676.06s | Cost: $0.01669

- Executed: True | Rejected: False | Judge: N/A
- Stages: autoiot_terms,autoiot_search_queries,autoiot_retrieval,autoiot_design_high,autoiot_design_detail,autoiot_module_gen,autoiot_code_integration,autoiot_agent_loop,autoiot_select
- Latency: 713.52s | Cost: $0.01735

- Executed: True | Rejected: False | Judge: N/A
- Stages: autoiot_terms,autoiot_search_queries,autoiot_retrieval,autoiot_design_high,autoiot_design_detail,autoiot_module_gen,autoiot_code_integration,autoiot_agent_loop,autoiot_select
- Latency: 225.15s | Cost: $0.00783

- Executed: True | Rejected: False | Judge: N/A
- Stages: autoiot_terms,autoiot_search_queries,autoiot_retrieval,autoiot_design_high,autoiot_design_detail,autoiot_module_gen,autoiot_code_integration,autoiot_agent_loop,autoiot_select
- Latency: 608.20s | Cost: $0.01558

- Executed: True | Rejected: False | Judge: N/A
- Stages: autoiot_terms,autoiot_search_queries,autoiot_retrieval,autoiot_design_high,autoiot_design_detail,autoiot_module_gen,autoiot_code_integration,autoiot_agent_loop,autoiot_select
- Latency: 457.34s | Cost: $0.01577

- Executed: True | Rejected: False | Judge: N/A
- Stages: autoiot_terms,autoiot_search_queries,autoiot_retrieval,autoiot_design_high,autoiot_design_detail,autoiot_module_gen,autoiot_code_integration,autoiot_agent_loop,autoiot_select
- Latency: 721.76s | Cost: $0.02220

- Executed: True | Rejected: False | Judge: N/A
- Stages: autoiot_terms,autoiot_search_queries,autoiot_retrieval,autoiot_design_high,autoiot_design_detail,autoiot_module_gen,autoiot_code_integration,autoiot_agent_loop,autoiot_select
- Latency: 546.82s | Cost: $0.01498

- Executed: True | Rejected: False | Judge: N/A
- Stages: autoiot_terms,autoiot_search_queries,autoiot_retrieval,autoiot_design_high,autoiot_design_detail,autoiot_module_gen,autoiot_code_integration,autoiot_agent_loop,autoiot_select
- Latency: 672.62s | Cost: $0.02057