flashfusion/results/with_slm_predictive/wisdm/run_2/metrics.csv

baseline,query_id,gt_score,gt_method,latency_s,cost_usd,input_tokens,output_tokens,executed,rejected,judge_verdict,stages_run,s1_latency_s,s2_latency_s,s3_latency_s,guardrail_latency_s,agent_latency_s,s1_latency_ms,s2_latency_ms,s3_latency_ms,guardrail_latency_ms,agent_latency_ms
AUTOIOT_PAPER,1,0.0,llm_judge_score,352.5535681247711,0.0093552,13314,5434,True,False,N/A,"autoiot_terms,autoiot_search_queries,autoiot_retrieval,autoiot_design_high,autoiot_design_detail,autoiot_module_gen,autoiot_code_integration,autoiot_agent_loop,autoiot_select",4.720235541000875,22.726365957998496,76.48399274999974,55.26357500099948,193.27632587500193,4720.235541000875,22726.365957998496,76483.99274999974,55263.57500099948,193276.32587500193
AUTOIOT_PAPER,2,1.0,llm_judge_score,166.09913396835327,0.00870826,13383,4923,True,False,N/A,"autoiot_terms,autoiot_search_queries,autoiot_retrieval,autoiot_design_high,autoiot_design_detail,autoiot_module_gen,autoiot_code_integration,autoiot_agent_loop,autoiot_select",14.292505000001256,16.018957708000016,44.108245709001494,50.40239500200005,41.19954287500332,14292.505000001256,16018.957708000016,44108.245709001494,50402.39500200005,41199.54287500332
AUTOIOT_PAPER,3,1.0,llm_judge_score,337.45568108558655,0.013409220000000001,17674,8845,True,False,N/A,"autoiot_terms,autoiot_search_queries,autoiot_retrieval,autoiot_design_high,autoiot_design_detail,autoiot_module_gen,autoiot_code_integration,autoiot_agent_loop,autoiot_select",8.2605346249984,23.984432667000874,77.30274454199935,66.1639436280002,161.66348970800027,8260.5346249984,23984.432667000874,77302.74454199935,66163.9436280002,161663.48970800027
AUTOIOT_PAPER,4,0.0,llm_judge_score,233.87478399276733,0.00903239,13600,5119,True,False,N/A,"autoiot_terms,autoiot_search_queries,autoiot_retrieval,autoiot_design_high,autoiot_design_detail,autoiot_module_gen,autoiot_code_integration,autoiot_agent_loop,autoiot_select",6.434114042001966,22.677859998999338,53.749325709000914,62.996984667004654,87.93535533399881,6434.114042001966,22677.859998999338,53749.325709000914,62996.98466700465,87935.35533399881
AUTOIOT_PAPER,5,0.0,llm_judge_score,726.6519529819489,0.01926692,24504,14783,True,False,N/A,"autoiot_terms,autoiot_search_queries,autoiot_retrieval,autoiot_design_high,autoiot_design_detail,autoiot_module_gen,autoiot_code_integration,autoiot_agent_loop,autoiot_select",7.891671665998729,29.737562166001226,127.70423199900142,169.3510151679966,391.89596050100045,7891.671665998729,29737.562166001226,127704.23199900142,169351.01516799658,391895.96050100046
AUTOIOT_PAPER,6,0.0,llm_judge_score,284.1990559101105,0.012138379999999999,15190,7332,True,False,N/A,"autoiot_terms,autoiot_search_queries,autoiot_retrieval,autoiot_design_high,autoiot_design_detail,autoiot_module_gen,autoiot_code_integration,autoiot_agent_loop,autoiot_select",14.848197832998267,23.67764354100109,112.93915195800037,47.15857204199892,85.50774937499773,14848.197832998267,23677.64354100109,112939.15195800037,47158.57204199892,85507.74937499773
AUTOIOT_PAPER,7,0.0,llm_judge_score,630.3169040679932,0.011157690000000001,13507,22200,True,False,N/A,"autoiot_terms,autoiot_search_queries,autoiot_retrieval,autoiot_design_high,autoiot_design_detail,autoiot_module_gen,autoiot_code_integration,autoiot_agent_loop,autoiot_select",403.49747941700116,39.05237087400019,70.540885876002,40.28667362499618,76.84677520900004,403497.47941700113,39052.37087400019,70540.885876002,40286.67362499618,76846.77520900004
AUTOIOT_PAPER,8,0.0,llm_judge_score,333.4178171157837,0.01032558,14346,5892,True,False,N/A,"autoiot_terms,autoiot_search_queries,autoiot_retrieval,autoiot_design_high,autoiot_design_detail,autoiot_module_gen,autoiot_code_integration,autoiot_agent_loop,autoiot_select",7.134327249999842,39.70688654100013,133.291312708001,53.799491375004436,99.40611870700013,7134.327249999842,39706.88654100013,133291.312708001,53799.491375004436,99406.11870700013
AUTOIOT_PAPER,9,0.0,llm_judge_score,633.4393191337585,0.019984150000000003,25716,14642,True,False,N/A,"autoiot_terms,autoiot_search_queries,autoiot_retrieval,autoiot_design_high,autoiot_design_detail,autoiot_module_gen,autoiot_code_integration,autoiot_agent_loop,autoiot_select",8.156147831999988,51.14520266599902,79.9792982100007,78.02372362499773,416.1288982919996,8156.147831999988,51145.20266599902,79979.2982100007,78023.72362499773,416128.8982919996
AUTOIOT_PAPER,10,0.0,llm_judge_score,577.9328560829163,0.023090390000000002,28868,17227,True,False,N/A,"autoiot_terms,autoiot_search_queries,autoiot_retrieval,autoiot_design_high,autoiot_design_detail,autoiot_module_gen,autoiot_code_integration,autoiot_agent_loop,autoiot_select",7.803226248999636,39.79595629100004,189.55079345699778,69.82659874999626,270.82846237399826,7803.226248999636,39795.95629100004,189550.79345699778,69826.59874999626,270828.46237399825
AUTOIOT_PAPER,11,0.0,llm_judge_score,455.55963611602783,0.019315689999999996,21289,12572,True,False,N/A,"autoiot_terms,autoiot_search_queries,autoiot_retrieval,autoiot_design_high,autoiot_design_detail,autoiot_module_gen,autoiot_code_integration,autoiot_agent_loop,autoiot_select",15.30884341699857,20.46749062500021,76.83577558399702,51.71385870600352,291.137562498996,15308.84341699857,20467.49062500021,76835.77558399702,51713.85870600352,291137.562498996
AUTOIOT_PAPER,12,0.0,llm_judge_score,1155.5964019298553,0.028271419999999988,31441,24976,True,False,N/A,"autoiot_terms,autoiot_search_queries,autoiot_retrieval,autoiot_design_high,autoiot_design_detail,autoiot_module_gen,autoiot_code_integration,autoiot_agent_loop,autoiot_select",10.517904207998072,33.72867662599674,109.66369783400296,219.01618458400117,782.5325314590082,10517.904207998072,33728.67662599674,109663.69783400296,219016.18458400117,782532.5314590081
AUTOIOT_PAPER,13,0.0,llm_judge_score,671.8636960983276,0.024947479999999998,33157,17450,True,False,N/A,"autoiot_terms,autoiot_search_queries,autoiot_retrieval,autoiot_design_high,autoiot_design_detail,autoiot_module_gen,autoiot_code_integration,autoiot_agent_loop,autoiot_select",7.499599959002808,25.24015120900367,83.09889187600129,255.83494766699732,300.1002369989983,7499.599959002808,25240.15120900367,83098.89187600129,255834.94766699732,300100.2369989983
AUTOIOT_PAPER,14,0.0,llm_judge_score,558.6455118656158,0.015516599999999997,22668,8721,True,False,N/A,"autoiot_terms,autoiot_search_queries,autoiot_retrieval,autoiot_design_high,autoiot_design_detail,autoiot_module_gen,autoiot_code_integration,autoiot_agent_loop,autoiot_select",13.40234641600182,21.835631333000492,123.19184858500012,83.57435587300279,316.51587462500174,13402.34641600182,21835.631333000492,123191.84858500012,83574.35587300279,316515.87462500174
AUTOIOT_PAPER,15,0.0,llm_judge_score,521.462336063385,0.018857890000000002,26465,12400,True,False,N/A,"autoiot_terms,autoiot_search_queries,autoiot_retrieval,autoiot_design_high,autoiot_design_detail,autoiot_module_gen,autoiot_code_integration,autoiot_agent_loop,autoiot_select",22.633244790999015,28.35657025099863,148.46360820799237,108.43430274899947,213.45616512399647,22633.244790999015,28356.57025099863,148463.60820799237,108434.30274899947,213456.16512399647
AUTOIOT_PAPER,16,0.0,llm_judge_score,315.0929729938507,0.015249809999999997,22084,9359,True,False,N/A,"autoiot_terms,autoiot_search_queries,autoiot_retrieval,autoiot_design_high,autoiot_design_detail,autoiot_module_gen,autoiot_code_integration,autoiot_agent_loop,autoiot_select",11.689028708995465,43.951751250995585,42.56238233300246,29.890238334002788,186.8899104569973,11689.028708995465,43951.751250995585,42562.38233300246,29890.238334002788,186889.9104569973
FLASH_FUSION,1,1.0,llm_judge_score,10.560337781906128,0.0015393699999999998,3345,170,True,False,N/A,"S1,S2,guardrail,S3,agent",0.6013741493225098,0.8490190505981445,2.8599140644073486,0.9384069442749023,4.60696005821228,601.3741493225098,849.0190505981445,2859.9140644073486,938.4069442749023,4606.96005821228
FLASH_FUSION,2,1.0,llm_judge_score,13.988054037094116,0.00168625,3458,287,True,False,N/A,"S1,S2,guardrail,S3,agent",0.37366485595703125,1.0821828842163086,3.781329870223999,0.6535611152648926,7.373031139373779,373.66485595703125,1082.1828842163086,3781.329870223999,653.5611152648926,7373.031139373779
FLASH_FUSION,3,1.0,llm_judge_score,12.717013835906982,0.00164296,3481,228,True,False,N/A,"S1,S2,guardrail,S3,agent",1.505568027496338,0.6596789360046387,2.9695959091186523,0.8347437381744385,6.022650957107544,1505.568027496338,659.6789360046387,2969.5959091186523,834.7437381744385,6022.650957107544
FLASH_FUSION,4,1.0,llm_judge_score,21.370301008224487,0.00195262,3667,467,True,False,N/A,"S1,S2,guardrail,S3,agent",1.1909708976745605,1.5434341430664062,4.403403997421265,0.9221179485321045,12.598627090454102,1190.9708976745605,1543.4341430664062,4403.403997421265,922.1179485321045,12598.627090454102
FLASH_FUSION,5,1.0,llm_judge_score,23.447030067443848,0.00224174,4078,631,True,False,N/A,"S1,S2,guardrail,S3,agent",0.5802948474884033,5.70430588722229,5.709705829620361,0.6284470558166504,10.124473094940186,580.2948474884033,5704.30588722229,5709.705829620361,628.4470558166504,10124.473094940186
FLASH_FUSION,6,1.0,llm_judge_score,32.314438819885254,0.0022886399999999998,3816,781,True,False,N/A,"S1,S2,guardrail,S3,agent",1.1303520202636719,1.0760829448699951,7.743741989135742,1.2355449199676514,20.435365200042725,1130.3520202636719,1076.0829448699951,7743.741989135742,1235.5449199676514,20435.365200042725
FLASH_FUSION,7,0.0,guardrail_skip_unexpected_rejection,8.700462102890015,0.00059576,1847,187,False,True,N/A,"S1,S2,guardrail",0.8323159217834473,5.320616006851196,0.0,1.8666789531707764,0.0,832.3159217834473,5320.616006851196,0.0,1866.6789531707764,0.0
FLASH_FUSION,8,1.0,llm_judge_score,16.282376050949097,0.00195502,3855,415,True,False,N/A,"S1,S2,guardrail,S3,agent",1.8138456344604492,0.5405361652374268,5.955410957336426,1.0231618881225586,6.281599044799805,1813.8456344604492,540.5361652374268,5955.410957336426,1023.1618881225586,6281.599044799805
FLASH_FUSION,9,1.0,guardrail_skip_expected_rejection,10.346357107162476,0.00064918,1929,266,False,True,N/A,"S1,S2,guardrail",0.8639161586761475,7.799705982208252,0.0,1.0182907581329346,0.0,863.9161586761475,7799.705982208252,0.0,1018.2907581329346,0.0
FLASH_FUSION,10,1.0,guardrail_skip_expected_rejection,7.709290027618408,0.00066292,1955,268,False,True,N/A,"S1,S2,guardrail",1.1902267932891846,4.1406660079956055,0.0,1.6979382038116455,0.0,1190.2267932891846,4140.6660079956055,0.0,1697.9382038116455,0.0
FLASH_FUSION,11,0.0,llm_judge_score,52.783310651779175,0.00294914,4342,1328,True,False,N/A,"S1,S2,guardrail,S3,agent",0.33323097229003906,1.933457851409912,10.300079107284546,0.85748291015625,38.68498492240906,333.23097229003906,1933.457851409912,10300.079107284546,857.48291015625,38684.98492240906
FLASH_FUSION,12,1.0,guardrail_skip_expected_rejection,11.889892101287842,0.0007884299999999999,2181,455,False,True,N/A,"S1,S2,guardrail",0.3693540096282959,5.969207048416138,0.0,4.873638868331909,0.0,369.3540096282959,5969.207048416138,0.0,4873.638868331909,0.0
FLASH_FUSION,13,0.0,llm_judge_score,61.402676820755005,0.0035083,5618,1227,True,False,N/A,"S1,S2,guardrail,S3,agent",2.2100861072540283,4.437957286834717,1.1756269931793213,1.19187593460083,51.75752401351929,2210.0861072540283,4437.957286834717,1175.6269931793213,1191.87593460083,51757.52401351929
FLASH_FUSION,14,0.0,llm_judge_score,89.60494184494019,0.00375081,5775,2142,True,False,N/A,"S1,S2,guardrail,S3,agent",5.512173891067505,0.9505829811096191,7.913463115692139,0.6186928749084473,73.92021989822388,5512.173891067505,950.5829811096191,7913.463115692139,618.6928749084473,73920.21989822388
FLASH_FUSION,15,1.0,llm_judge_score,47.47021007537842,0.00238814,4148,739,True,False,N/A,"S1,S2,guardrail,S3,agent",1.7812328338623047,1.447580099105835,28.092802047729492,0.7821450233459473,14.67292594909668,1781.2328338623047,1447.580099105835,28092.802047729492,782.1450233459473,14672.92594909668
FLASH_FUSION,16,1.0,llm_judge_score,50.450218200683594,0.00233189,4391,1083,True,False,N/A,"S1,S2,guardrail,S3,agent",5.736104249954224,2.817627191543579,18.919039011001587,3.024205207824707,19.277180910110474,5736.104249954224,2817.627191543579,18919.039011001587,3024.205207824707,19277.180910110474
REACT_ONLY,1,1.0,llm_judge_score,7.999749183654785,0.00025402,381,37,True,False,N/A,react_agent,0.0,0.0,0.0,0.0,0.0,0.0,0.0,0.0,0.0,0.0
REACT_ONLY,2,1.0,llm_judge_score,39.65835499763489,0.00025479,389,32,True,False,N/A,react_agent,0.0,0.0,0.0,0.0,0.0,0.0,0.0,0.0,0.0,0.0
REACT_ONLY,3,1.0,llm_judge_score,5.134986877441406,0.00028495,412,53,True,False,N/A,react_agent,0.0,0.0,0.0,0.0,0.0,0.0,0.0,0.0,0.0,0.0
REACT_ONLY,4,1.0,llm_judge_score,6.749571084976196,0.00024278,374,28,True,False,N/A,react_agent,0.0,0.0,0.0,0.0,0.0,0.0,0.0,0.0,0.0,0.0
REACT_ONLY,5,1.0,llm_judge_score,9.254271984100342,0.00039286,382,212,True,False,N/A,react_agent,0.0,0.0,0.0,0.0,0.0,0.0,0.0,0.0,0.0,0.0
REACT_ONLY,6,1.0,llm_judge_score,7.218603134155273,0.00041692000000000004,396,232,True,False,N/A,react_agent,0.0,0.0,0.0,0.0,0.0,0.0,0.0,0.0,0.0,0.0
REACT_ONLY,7,1.0,llm_judge_score,8.869462013244629,0.00033873000000000003,388,139,True,False,N/A,react_agent,0.0,0.0,0.0,0.0,0.0,0.0,0.0,0.0,0.0,0.0
REACT_ONLY,8,1.0,llm_judge_score,12.65013599395752,0.00034146999999999997,398,135,True,False,N/A,react_agent,0.0,0.0,0.0,0.0,0.0,0.0,0.0,0.0,0.0,0.0
REACT_ONLY,9,0.0,llm_judge_score,16.02812695503235,0.00056051,393,416,True,False,N/A,react_agent,0.0,0.0,0.0,0.0,0.0,0.0,0.0,0.0,0.0,0.0
REACT_ONLY,10,1.0,llm_judge_score,16.074713945388794,0.0005948400000000001,407,449,True,False,N/A,react_agent,0.0,0.0,0.0,0.0,0.0,0.0,0.0,0.0,0.0,0.0
REACT_ONLY,11,0.0,llm_judge_score,42.32432293891907,0.00101394,721,745,True,False,N/A,react_agent,0.0,0.0,0.0,0.0,0.0,0.0,0.0,0.0,0.0,0.0
REACT_ONLY,12,0.0,llm_judge_score,11.419968128204346,0.00046763,415,282,True,False,N/A,react_agent,0.0,0.0,0.0,0.0,0.0,0.0,0.0,0.0,0.0,0.0
REACT_ONLY,13,0.0,llm_judge_score,19.007127046585083,0.00048319999999999993,507,233,True,False,N/A,react_agent,0.0,0.0,0.0,0.0,0.0,0.0,0.0,0.0,0.0,0.0
REACT_ONLY,14,0.0,llm_judge_score,61.51667404174805,0.0012025999999999998,1176,644,True,False,N/A,react_agent,0.0,0.0,0.0,0.0,0.0,0.0,0.0,0.0,0.0,0.0
REACT_ONLY,15,1.0,llm_judge_score,14.387109994888306,0.00048501,494,245,True,False,N/A,react_agent,0.0,0.0,0.0,0.0,0.0,0.0,0.0,0.0,0.0,0.0
REACT_ONLY,16,1.0,llm_judge_score,17.576644897460938,0.00052526,510,284,True,False,N/A,react_agent,0.0,0.0,0.0,0.0,0.0,0.0,0.0,0.0,0.0,0.0

flashfusion/results/with_slm_predictive/wisdm/run_2/report.md

#### AUTOIOT_PAPER

- Executed: True | Rejected: False | Judge: N/A
- Stages: autoiot_terms,autoiot_search_queries,autoiot_retrieval,autoiot_design_high,autoiot_design_detail,autoiot_module_gen,autoiot_code_integration,autoiot_agent_loop,autoiot_select
- Latency: 352.55s | Cost: $0.00936

- Executed: True | Rejected: False | Judge: N/A
- Stages: autoiot_terms,autoiot_search_queries,autoiot_retrieval,autoiot_design_high,autoiot_design_detail,autoiot_module_gen,autoiot_code_integration,autoiot_agent_loop,autoiot_select
- Latency: 166.10s | Cost: $0.00871

- Executed: True | Rejected: False | Judge: N/A
- Stages: autoiot_terms,autoiot_search_queries,autoiot_retrieval,autoiot_design_high,autoiot_design_detail,autoiot_module_gen,autoiot_code_integration,autoiot_agent_loop,autoiot_select
- Latency: 337.46s | Cost: $0.01341

- Executed: True | Rejected: False | Judge: N/A
- Stages: autoiot_terms,autoiot_search_queries,autoiot_retrieval,autoiot_design_high,autoiot_design_detail,autoiot_module_gen,autoiot_code_integration,autoiot_agent_loop,autoiot_select
- Latency: 233.87s | Cost: $0.00903

- Executed: True | Rejected: False | Judge: N/A
- Stages: autoiot_terms,autoiot_search_queries,autoiot_retrieval,autoiot_design_high,autoiot_design_detail,autoiot_module_gen,autoiot_code_integration,autoiot_agent_loop,autoiot_select
- Latency: 726.65s | Cost: $0.01927

- Executed: True | Rejected: False | Judge: N/A
- Stages: autoiot_terms,autoiot_search_queries,autoiot_retrieval,autoiot_design_high,autoiot_design_detail,autoiot_module_gen,autoiot_code_integration,autoiot_agent_loop,autoiot_select
- Latency: 284.20s | Cost: $0.01214

- Executed: True | Rejected: False | Judge: N/A
- Stages: autoiot_terms,autoiot_search_queries,autoiot_retrieval,autoiot_design_high,autoiot_design_detail,autoiot_module_gen,autoiot_code_integration,autoiot_agent_loop,autoiot_select
- Latency: 630.32s | Cost: $0.01116

- Executed: True | Rejected: False | Judge: N/A
- Stages: autoiot_terms,autoiot_search_queries,autoiot_retrieval,autoiot_design_high,autoiot_design_detail,autoiot_module_gen,autoiot_code_integration,autoiot_agent_loop,autoiot_select
- Latency: 333.42s | Cost: $0.01033

- Executed: True | Rejected: False | Judge: N/A
- Stages: autoiot_terms,autoiot_search_queries,autoiot_retrieval,autoiot_design_high,autoiot_design_detail,autoiot_module_gen,autoiot_code_integration,autoiot_agent_loop,autoiot_select
- Latency: 633.44s | Cost: $0.01998

- Executed: True | Rejected: False | Judge: N/A
- Stages: autoiot_terms,autoiot_search_queries,autoiot_retrieval,autoiot_design_high,autoiot_design_detail,autoiot_module_gen,autoiot_code_integration,autoiot_agent_loop,autoiot_select
- Latency: 577.93s | Cost: $0.02309

- Executed: True | Rejected: False | Judge: N/A
- Stages: autoiot_terms,autoiot_search_queries,autoiot_retrieval,autoiot_design_high,autoiot_design_detail,autoiot_module_gen,autoiot_code_integration,autoiot_agent_loop,autoiot_select
- Latency: 455.56s | Cost: $0.01932

- Executed: True | Rejected: False | Judge: N/A
- Stages: autoiot_terms,autoiot_search_queries,autoiot_retrieval,autoiot_design_high,autoiot_design_detail,autoiot_module_gen,autoiot_code_integration,autoiot_agent_loop,autoiot_select
- Latency: 1155.60s | Cost: $0.02827

- Executed: True | Rejected: False | Judge: N/A
- Stages: autoiot_terms,autoiot_search_queries,autoiot_retrieval,autoiot_design_high,autoiot_design_detail,autoiot_module_gen,autoiot_code_integration,autoiot_agent_loop,autoiot_select
- Latency: 671.86s | Cost: $0.02495

- Executed: True | Rejected: False | Judge: N/A
- Stages: autoiot_terms,autoiot_search_queries,autoiot_retrieval,autoiot_design_high,autoiot_design_detail,autoiot_module_gen,autoiot_code_integration,autoiot_agent_loop,autoiot_select
- Latency: 558.65s | Cost: $0.01552

- Executed: True | Rejected: False | Judge: N/A
- Stages: autoiot_terms,autoiot_search_queries,autoiot_retrieval,autoiot_design_high,autoiot_design_detail,autoiot_module_gen,autoiot_code_integration,autoiot_agent_loop,autoiot_select
- Latency: 521.46s | Cost: $0.01886

- Executed: True | Rejected: False | Judge: N/A
- Stages: autoiot_terms,autoiot_search_queries,autoiot_retrieval,autoiot_design_high,autoiot_design_detail,autoiot_module_gen,autoiot_code_integration,autoiot_agent_loop,autoiot_select
- Latency: 315.09s | Cost: $0.01525